,age,body_type,diet,drinks,drugs,education,essay0,essay1,essay2,essay3,essay4,essay5,essay6,essay7,essay8,essay9,ethnicity,height,income,job,last_online,location,offspring,orientation,pets,religion,sex,sign,smokes,speaks,status
1078,43,athletic,anything,socially,never,graduated two year college,living texas don hold used day dream one day seeing colored rainbow inter bridge home simply awesome goodness men much catching know want anything lay love,working two news job honest long enough dislike,meaningless thing bring joy heart basketball reverse engineering making thing better found telling joke,tall bald grey eye,art war amazing simplicity man food serving size hip hop amp classic rock eat meat every meal possible,sense humor family chicken vindaloo good book able eat whatever gain weight basketball,purpose life,probably home don know many people,want stand sometimes thinking funny thing crack act cell look crazy laughing bus,interested exploring relationship friendship making laugh check city,black white,74,,clerical administrative,2012 06 30 11 43,san francisco california,doesn rsquo kid might want,straight,dog like cat,christianity somewhat serious,,leo rsquo fun think,,english fluently,single
1098,23,average,mostly anything,rarely,never,graduated college university,fairly outgoing optimistic friendly always type person get along everyone may nicest person ve met genuine guess bit old fashioned polite nice always make happy people around happy care drug fact hate alcohol quite alright though raised moral mean lot re looking nice family oriented guy gentleman goal life work animation passion grew drawing trying mimic old cartoon hope make looking looking someone isn afraid key factor respect humor top want find real relationship something will last,went archery think make regular thing goal life work animation passion grew drawing trying mimic old cartoon want make got bachelor degree animation visual effect live work full time job thinking getting second bachelor focusing becoming paralegal,getting stuck red light anything computer drawing problem solving consoling listening apparently customer service,know different guy people know know needle haystack need lose hay first glance pointy chin appears talking easy along hold intelligent conversation well super sarcastic one,book anything michael crichton jurassic park favorite hadn read quite picking reading assassin creed book finished state fear mr crichton movie jurassic park avenger madagascar avatar train dragon toy story kung fu panda avenger iron man anything liam neeson jackie chan show sanctuary white collar terra nova walking dead ncis family guy lot thing history channel science channel music scorpion foreigner boston 30 second mar angel airwave rise poet fall hoobastank shinedown breaking benjamin italobrothers eiffel 65 bloom06 avantasia edguy many others thing won listen country rap food italian chinese mexican anything spicey,family friend personality outdoors concrete forest natural one computer little kitten,life going going decision made right one short future love thinking history astrological thing,working playing video game hanging friend family combination,congo scared heck young never looked gorilla way,read know much profile say will answer question best,white,66,,sale marketing biz dev,2012 07 01 02 19,benicia california,doesn rsquo kid might want,straight,like dog like cat,agnosticism serious,,aries rsquo fun think,,english fluently french poorly,single
1117,29,fit,mostly anything,socially,never,graduated master program,really involved wearing bow tie lactose intolerant vocal tattoo state california forearm pierced ear dance shit damned keep trying told dmv test giver best parallel parker basically time ve able satisfy woman bit d2 d9 tendency bit d8 d1 address ve slept couch sunglass multiple time eat spam vote absolutely love career extremely lucky found passion arty love midcentury modernism los angeles freeway small dog photography often loud,politics urban planning taking meeting cutting bitch,cuddling getting un lost,eye somewhat shifty smile depending venue,architecture happiness velvet rage zen art archery boy meet boy single man visual acoustic eat pray love star trek vi star trek 500 day summer shelter paris texas kill bill sleepless seattle deep space big bang theory modern family frasier xx miike snow toro moi bon iver calvin harris rus chime jimmy eat world empire sun adele phoenix drake nicki minaj spam burrito jook soon du boo pho sushi tecate hendricks kimbap pumpkin curry cha sui bao papusas phillipe french dip green bean casserole tortas chocolate chocolate chip cooky oh shrimp burrito little omfg,friend family chocolate california iphone music bike,will nice addition okcupid profile immeasurable impact sustainability focused development practice doubt longterm urban settlement pattern overall livability state california beyond obviously former,drinking week turn nun prostitution gleefully eating whichever easiest pull together 30 00 text message situationally appropriate,monagmish,looking make new friend meet cool people,,70,,political government,2012 06 30 23 29,san francisco california,want kid,gay,like dog like cat,,,gemini rsquo fun think,,english fluently spanish okay french poorly,seeing someone
1120,33,fit,strictly anything,often,sometimes,graduated college university,scot irish read white trash german jew smartish well read bad money prone various excess given boozy sentiment hyperbole,playing music traveling bartending converting oxygen carbon dioxide,bass guitar,right achilles heel,start kurt vonnegut tom robbins oscar wilde jack kerouac hunter thompson kafka italno calvino bukowski bladerunner child men hot dr strangelove blue brother coltrane mile radiohead james brown otis redding sam cooke beethoven chopin bartok beck belle sebastian mike patton faith patsy cline marisa monte bob dylan sigur ro bjork john prine beck food except cheetos shit favorite japanese italian mexican vietnamese middle eastern show louie rescue 30 rock night court seinfeld arrested development rome curb deadwood,alpo beer cop drug earlobe frontal lobe,little possible,working,glancing as mirror taking shower pretending belongs gael garcia bernal,opposable thumb,white,70,40000,artistic musical writer,2012 06 26 16 18,san francisco california,doesn rsquo kid doesn rsquo want,bisexual,like dog like cat,atheism laughing,,cancer doesn rsquo matter,,english italian fluently spanish poorly,single
1141,39,average,mostly anything,socially,never,graduated college university,secure amp happy self little self enjoy going play opera travel camping lake working yard music museum cooking going dinner amp hanging friend family lineage made best ingredient part english french jewish native american amp puerto rican say way man heart stomack well good cook good lover top amp hiv earth guy looking tender loving care raised country country value living city year cultured enjoy going bed good book looking guy honest wise,work management small firm city future business working,good multitasking,height,something talk first date,family food water chocolate ipad cell phone,future,amp,now amp will tell,wish,,74,,clerical administrative,2012 06 27 15 31,san francisco california,doesn rsquo kid might want,gay,like dog like cat,catholicism somewhat serious,,cancer doesn rsquo matter,,english fluently spanish fluently,single
1146,29,average,mostly anything,socially,never,graduated two year college,matt turn 29 april bartend wait table living music animal art etc probably neutral guy ll meet witty sarcastic shy time guess walking contradiction,growing human,making best worst,piercing blue eye dimple talli guy pretty genuine told people know finding older strogic lover ll definitely listen hopeless romantic,music every thing punk metal hip hop sort rockabilly artist enjoy afi pantera pennywise slipknot converge korn bleeding integrity madball morrissey atmosphere wu tang johny cash tiger army hank williams book preacher choke watchman le zero fight club movie taxi driver new batman professional boondock saint evil dead food ll eat almost thing mexican italian chinese good old fashioned american piece red meat steak cheese burger enjoy sushi time time,beer book food broadband internet music dog direct tv nice,next chapter,friend working,saw limp bizkit three time twice korn filter counted bfd 2000 purposely left played,drop hot want,white,75,,,2012 07 01 02 23,alameda california,doesn rsquo kid,straight,like dog,agnosticism laughing,,aries doesn rsquo matter,,english fluently,single
1153,44,average,anything,socially,never,graduated master program,new tact online dating new year direct seems inordinate number men 40 nothing snowboard travel around world yet want kid someday men probably read ve got something offer looking honest interesting caring person display public affection welcome opening door general courteous chivalrous action will always noticed appreciated adventure yes two kid every weekend thailand great long range trip planned spontaneous one much organized sport fan told played recent superbowl said understand important sport interest choose spend much time building thing love garage turned idea handle power drill instead intimidated fun diy project think snowboarding must fantastic lot downhill skiing growing kind want go weekend committed great,raising teaching two boy caring responsible interesting people thing strive elementary school teacher trying figure new balance personal professional commitment addition carving time social life looking explore new old interest cake decorating teaching art class return swing dancing,creating figuring thing constructed deciding whether recreate thing looking opening etsy shop hand crafted item,friendly open positive engaging one piece advice mother gave interested interesting think took advice heart,don watch much commerical tv mostly stick reading watching dvd ll admit plowing lot bbc costume drama recommendation friend movie missed theater love old movie anything pre code movie myrna loy william powell katherine hepburn cary grant field marx brother busby berkeley production frank capra list go bonus point know quote gift new movie pretty much anything pixar favorite recent documentary fold helvetica parking lot movie book used librarian currently teach 4th grade two young son child literature still huge part life currently reading rick riordan book soon son finish fascinated introduction greek roman mythology young reader love good tea cosy mystery agatha christie margery allingham elizabeth peter well historical fiction picked recent book jasper fforde loved tuesday next series music taste vary widely especially enjoy music 1920 1950 child 80 though pretty good range new wave pop behind grew listening kroq pasadena enjoy classical ambient anything harmonica bagpipe try food total omnivore draw line tripe animal part decent cook prefer baking cooking ll enjoy appreciate anything anyone fix,kid humor honesty integrity think need go together right common decency consideration opportunity learn try something new surrounded thing give pleasure good pot tea especially tea sandwich proper tea cup linen rule breaking thing paper paper lot amp pencil fondness freshly sharpened pencil,rest life look much feel add around think life list although lot thing wind wasn planning driving fire truck dancing chinese new year parade,alternately kid home eating pizza fun friend,hm conversation starter person,think enjoy company coffee tea dinner creative endeavor good project involving power tool glue gun mini adventure barbary coast walking tour,white,68,,education academia,2012 06 30 00 39,san francisco california,kid,straight,like dog dislike cat,atheism laughing,,sagittarius rsquo fun think,,english,single
1176,37,athletic,mostly anything,socially,never,graduated college university,newish sf year now enjoying life feel lucky ve lived abroad traveled extensively wandered pursued whim basically whatever hell wanted totally worth now life stable balanced managed land good job one best city world try enjoy area much possible self description strong silent kind gentleman independent spiritual athletic simple subtle understated curious intense proud sarcastic loyal honest genuine,running hiking playing soccer volleyball riding bike taking road trip skiing watching movie discovering music taking picture drinking dive bar absorbing california sitting park napping managing project advertising company friend brother son uncle,hurdle trivia driving direction jenga cornhole skipping dry humor word association taking shirtless cellphone picture mirror,tall blonde easy spot crowd,small sample spoon morning jacket radiohead beck wilco tv radio greek food sushi bbq fat tire shot pint seafood steak siddhartha little prince wire netflix,coffee competition spotify internet michigan hope,improve going next whether grass greener side,usually meeting friend work happy hour sometimes recovering big thursday resting big saturday leaving town,pony make cry,want go outside something walk hike run bike whatever re drama free don take seriously re thirsty feel grabbing drink,white,76,,sale marketing biz dev,2012 06 30 09 05,san francisco california,doesn rsquo kid want,straight,like dog like cat,agnosticism serious,,gemini doesn rsquo matter,sometimes,english fluently,single
1179,60,little extra,strictly,,never,two year college,photo oldest daughter gal short hair married 38 year husband passed away year ago really nervous scared meet one kind person good heart hoping meet someone enjoys life family much,happy person learning live life loving every minute,patient tolerant understanding,kind person genuine heart,enjoy reading book sidney sheldon john grishman going movie theater something try regularly love going listen music either jazz latin jazz enjoy cooking going nice dinner good conversation,family pet friend love compassion good music,meeting one beautiful grand daughter,getting together friend home curled couch watching good movie long week work,nervous starting date,interested,white,63,,,2012 05 30 12 14,san leandro california,kid,straight,dog cat,,,leo,,english,single
1213,34,fit,mostly anything,socially,never,graduated master program,born poland raised egypt originally bangladesh went high school india came 1996 belgium went school upstate ny grad school boston time lived worked danbury ct nyc austin tx portland bay area ask question ll always honest answer tend wear heart sleeve thought forehead love sf good core group friend surround passionate work work life balance important believe 40 40 20 rule 40 time work 40 time partner 20 friend running important don expect partner one generally eat healthy eat everything foodie food snob love cook generally stay week night try catch friend hump day value loyalty honesty kindness important liberal non judgmental trusting someone comfortable skin don give people try help whenever appreciate nice glass vino much morning starbucks latte sunday glued football might go walk wander around city run spinning couple time week waking sun make happy easy going laugh lot spontaneous don want partner rude dishonest selfish cheap manipulative generally playful prefer someone like share isn look partner,mid stage career good love great group friend sf home love buy place someday want continue grow person definitely want kid someday partner crime nice touch finish picture,explaining thing people making sure everyone get along,filter,book spend enough time reading contract movie always going movie favorite show love live music music listen biased towards 80 top 40 hip hop food live sf always trying new cuisine foodie,iphone music vino sunshine sf people,working hard playing hard organize activity,love catching friend co worker happy hour,particularly close family love kid sister,want meet drink work,indian,68,150000,sale marketing biz dev,2012 07 01 06 39,san francisco california,doesn rsquo kid might want,straight,like dog,agnosticism,,scorpio,,english,single
1237,37,average,mostly,,never,working ph program,born grew oakland ca looking kind caring honest single woman spend quality time build lasting relationship may include short trip sporting event nice picnic quiet evening home hold intelligent conversation topic news today type person send flower significant,currently working special project related field management amp marketing profession busy schedule willing spend quality time right person,showing compassion lending shoulder cry helping others need showing respect others,tall asian male say look younger actual age stay fit playing sport running,favorite show miss epsiode day life law amp order svu criminal mind closer music enjoy include mariah carey whitney houston michelle branch phil collins food enjoy tasting chinese american japanese,coke day fastfood twice week responding email watching nfl superbowl shopping walmart surfing craigslist,enjoy life given daily stress given day,hulu catching favorite tv show missed week,busty woman always attention,think commonality want explore,asian,70,40000,education academia,2012 07 01 08 40,oakland california,doesn rsquo kid want,straight,like dog,,,leo,,english fluently,single
1246,30,curvy,strictly vegetarian,,never,working ph program,art babe indie filmmaker san franciscan extraordinaire looking expand social circle make new connection enjoy anitquarian book store cult classic traveling abroad political discussion eco minded folk thing east buddhism yoga vintage diy fashion vegan lifestyle oriented nature friendly holistic social comedic long walk beach passionate curious strong,independent producing directing risk taker impassioned lover life conductor creative expression,psychological profiling directing control exposing vulnerability facilitating love driving anything fast performing improvisationally making people laugh hard piss,heart eye lip,gift hafiz letter young poet rmrilke anything jeanette winterson philip glass scissor sister jeff buckley bowie fugazi peach le tigre sonic youth velvet underground indian food vegetarian dish tofutti creme brulee decent cappucino,collection emile varo print first edition print duineo elegy bolex camera box old love letter passion thrill seeking gene,filmmaking photography existentialism surrealism french new wave alchemy pushing social boundary david lynch call response jazz paris tantra global politics feminist construct northern shaolin social relationship rainer maria rilke ofcourse dharma,gallery opening kicking homies making dinner,perform kundalini yoga bath,re looking friendship collaborative partner philisophical discussion,white,65,,artistic musical writer,2012 07 01 02 13,san francisco california,doesn rsquo kid want,gay,like dog like cat,buddhism serious,,cancer,,english fluently hebrew okay french fluently,single
1278,29,little extra,mostly anything,socially,never,graduated college university,probably tell username marlon happily born raised bay area music life technology oh yeah something called food incredibly delicious cheering bay area sport team whether winning overall believe life constant journey filled many adventure experience hopefully share adventure sometime,live left brain right brain kind life software engineer day keyboardist instrumental band night hobby enjoy driving walking around city taking scenic photo playing piano guitar occasional running basketball hitting batting cage satisfy baseball withdrawal singing karaoke voice work sadly isn time,solving problem fixing thing supportive others,pretty laid back lazy sense exploring new place experiencing new thing excites generally optimistic life know see good others,book um wikipedia count much book reader except job related case point currently reading javascript good part movie office space inception remember titan hangover anything made pixar show anything sport related anything discovery channel food network music love going concert try go least one month stevie wonder role model amp will always favorite genre listen everything current inclination day hip hop alt rock indie rock food ll admit sucker italian food love food general fast food though,family friend remain close camera piano laptop basketball flashlight case sun explodes something,going next day usually take thing one day time,singing karaoke friend san mateo always fun time especially try rapping fast song run breath time,usually lose voice go roller coaster oh clown scare,curious want know maybe want know favorite song moment ve reading profile whatever ll happy chat anytime,asian,66,,science tech engineering,2012 05 24 22 07,san bruno california,doesn rsquo kid want,straight,like dog dislike cat,catholicism,,gemini,,english fluently spanish poorly tagalog poorly,single
1281,25,curvy,mostly vegetarian,socially,sometimes,graduated college university,recently moved oakland six year spent dead suburbia orange county born libyan parent grew rome cairo damascus life constant ongoing identity crisis never learned ride bike giggle lot rarely take anything seriously yet pretty serious person good writing self summary never say,cog supply chain stay afloat working grad school application comp lit lazing around adventuring discovering area forging new bond going bar show park searching community failing seeking displaced weaving aesthetic political outrageous inappropriate chainsmoking drinking beer backyard awkward around kid,language writing giggling cooking listening inappropriate,height small foot loud giggle,djebar ben jelloun balzac kundera maupassant name dura baudelaire rimbaud claude cahun houda barakat mohamed dib flaubert colette nancy houston bataille huysmans albert memmi zola resnais truffaut jodorowski dario argento giallo horror binge lately lynch bergman pasolini catherine breillat kiarostami makhmalbaf six foot twin peak mad men joanna newsom gainsbourg bloody valentine pixy portishead atlas sound deerhunter stereolab fairouz marcel khalife naseer shamma abdelhalim hafez,impermanence olive oil shower internet music cliche know except hour commute every day thing make bearable cynical disposition,gender language identity displacement postcolonialism memory circular linear narrative break tradition modernity trope writing thing arab pushing boundary language finding home language translate overcome schizophrenia new restaurant try new recipe make internet loop war make life feel le unsatisfying unfulfilling empty,friend place bar event city bed netflix book wasting time tumblr,teenager aunt make watch baby cousin pinch make stop cry,want grab drink catch show watch movie cook together make new friend chainsmoking session practice french practice arabic practice stand routine practice practice everyday life la michel de certeau,middle eastern,60,,,2012 06 27 14 08,oakland california,doesn rsquo kid doesn rsquo want,bisexual,cat,atheism laughing,,gemini doesn rsquo matter,yes,english fluently arabic fluently french fluently italian okay spanish poorly,single
1305,22,athletic,mostly anything,socially,never,working two year college,quite reserved guy tend independent keep work lot school friend keep healthy sane don drink coffe soda never tried coffe enough energy need know someone awesome personality will nothing love art music reading almost every day love going adventure even planning anything getting fun part ll probably tough guy along chemistry promise will best thing,currently collage student studying marketing brand development fashion design yeah thats right straight guy know fashion thought existed well assure unique taste still studying job lined currently intern now though,ve snowboarding ten year making people laugh enjoy sport sprot really outdoors love longboarding enjoy making story writing short poem acting filming ve friend short film,ginger ha ask soul oh nice face stare tell creeped,favorite movie hitchhiker guide galaxy favorite show mad men sherlock eastbound south park family guy old one futurama dont favorite food eat anything ha favorite music grew jazz john coltane steely dan tower power best love big band music dean martin frank sinatra enjoy lot new music black key bloody beetroot rjd2 amy winehouse bassnecter childish gambino girl talk pretty much music classic best,friend family skateboard art music laughing,crazy ludicrous idea funny story scenario enjoy debate friend especially politics science philosophy space favorite,friend hanging maybe going around town messing around house drinking typically playing board game funny pose camera,used punch kick sleep secret huge nerd pretty self conscious sometimes will quite enjoy dreaming little self conscious awesome ha,really wanna know little weird life little weird find someone whose weirdness compatible join fall mutual weirdness call love dr seus,white,68,20000,student,2012 06 27 13 04,san francisco california,doesn rsquo kid,straight,like dog like cat,laughing,,cancer doesn rsquo matter,,english fluently,single
