,age,body_type,diet,drinks,drugs,education,essay0,essay1,essay2,essay3,essay4,essay5,essay6,essay7,essay8,essay9,ethnicity,height,income,job,last_online,location,offspring,orientation,pets,religion,sex,sign,smokes,speaks,status
475,61,athletic,mostly anything,socially,never,graduated master program,chronological age deceiving loaded energy actually young friend guess part 15 year old ve always active athletic enjoy appropriately younger men keep youthful men age equally committed active healthy lifestyle work daily bike hike practice healthy living fit shape fun love sort activity course travel spending time friend farmer market museum theater concert dancing foreign flick entertaining cooking used teach little wouldn open spontaneous adventure time happy reading sitting around talking watching movie eating popcorn saturday night tv watcher convinced chill ve told strong woman independent low maintenance trim tree fix thing still appreciate someone ll tell put oil car stuff much accommodator make everyone happy funny good telling story openly affectionate find sensuous always even keel always optimistic loyal kind golden retriever minus drool sweet probably great description big heart recognize relationship start first date building friendship don feel race make something happen long term want committed relationship want wake morning look eye man love want man great communicator man heart care beyond portal life man passion something life something fire take hold heart energizes looking man challenge tease make laugh man awhile get wild hair say hey let go even unconventional seems craziest thing especially let duck order make move kind gal,happy great description now self employed corporate trainer teach public speaking teaching writing blog spending time son giving back important support sister rwanda economically independent friend family need always,even keel time teaching writing coaching communicating parenting building relationship helping people figure thing mentoring leadership thinking box seeing good everyone every situation handling emergency making people feel good spontaneous taking care health intimate wonderful friend great girlfriend,smile voice make sound taller make people feel comfortable immediately easy don look age much attractive photo ask lot question know,love kind food music except reggae love live theater concert dance book personal growth leadership travel,freedom friend great sex travel opportunity personal growth opportunity make difference someone life,son man dream traveling cook next help child ve enslaved staying healthy fit,something son although interest waning fast,going admit private ask want know,think chemistry will know don take chance,white,60,,education academia,2012 06 24 00 14,san francisco california,kid,straight,dog,judaism serious,,sagittarius doesn rsquo matter,,english fluently,single
496,30,curvy,anything,socially,never,college university,love life family friend everything life offer love cook discover learn different thing people friendly outgoing family oriented,working better person everyday mother daughter sister friend working well prosper work work work,helping needed listening cooking laughing list go,smile eye,love self improvement book inspirational biography big fan 80 amp soul love song blah blah blah girly 80 movie love will amp grace mad caroline city cosbys different world living single family matter punky brewster family tie keeping kardashians khloe amp lamar 227 amen list go mention goodtimes empty nest golden girl hehe,good company love laughter god given amp expierences good bad family,life store family reaching highest potential praying child grow happy well rounded people self supportive contributing society,usually working preparing work ideally house full friend family stopping dinner game movie night sometimes time hit town,always first boo hoo touching commercial movie graduation,interested knowing,black,64,,,2012 06 30 00 05,oakland california,kid might want,straight,like dog,christianity somewhat serious,,virgo rsquo fun think,,english,single
524,30,fit,strictly anything,socially,never,working ph program,ve known friend created account okcupid seem pretty normal figured start page hurt right guess ll find soon enough hope website doesn become another addicting website facebook last thing need life right now checking another webpage regular basis really don much free time never thought page dating site site actually seems fun plus free,moved bay area three year ago begin pursuing doctoral degree clinical psychology currently living berkeley love though wish actually got hot summer far grad school ve worked adult drug addiction emotionally disturbed kid therapist middle school licensed psychologist plan continue working served population currently attempting write dissertation free time isn enough try much fun possible includes hanging friend going partying occasionally going concert surfing snowboarding chance mountain biking summer staying physically active cliche sound try work hard play hard dad used tell don let book way college education,getting bored living well little money gotta love student loan listening people fixing working stuff car computer bike etc pull ups year back thought beat record pull ups 60 second definitely didn happen,hopefully smile eye possibly nose try take seriously,movie forrest gump high fidelity pulp fiction garden state eternal sunshine spotless mind brokeback mountain departed superbad old school love drug back future documentary music start red hot chili pepper pearl jam van halen gun rose brand new dredg story year jimmy eat world death cab cutie something corporate say anything many many hate people list bunch obscure band don truly look hip listen listen food pretty much anything picky steak sushi huge burrito thai show son anarchy dexter walking dead always sunny philadelphia scrub sorta started watching tv year weird,air water friend family good food good conversation laughing cat philly active know doubled lot,going eat next meal plan weekend need fix house living going write dissertation,hopefully studying though possibility hanging friend house somewhere possibly drink good laugh possibly watching movie friend,feel though adhd possibly mild ocd quality friend tell addicted ebay getting good deal living well little money account okcupid,re creepy weird might want hang chat grab drink little weird okay guess,white,69,,student,2012 06 27 17 46,berkeley california,doesn rsquo kid,straight,like dog cat,agnosticism serious,,taurus doesn rsquo matter,,english fluently spanish poorly,single
529,26,average,anything,socially,never,dropped college university,watching movie wakeboarding snowboarding watching pro sport good time true friend sometimes fault told soft heart thats ok getting along people dont care drama hard working sweet atheletic,work waste management firm contra costa co enjoy work business recession proof working company last year making name organization someday management position now enjoy learning rope ground floor,ive always pretty good sport football soccer basketball etc im starting discover real talent good listening people need somone talk,people take one look tell im italian italian love food family social gathering,facebook profile book dan brown book movie movie except sad one tv show dont want much tv football baseball soccer music sort music list favorite mac dre slightly stoopid metallica eminem sage francis offspring nirvanna pepper bone thug harmony beck alice chain favorite food pizza pasta nut sushi particularly kamons sacramento ummmmm,love car phone family friend sport,future friend family desire buy house place move company find solid relationship,usually often friend usually end bar completely given hope finding serious relationship thats one reason trying site dont anything good time club bar hoping relatioship seen come bar scene,bit old fashioned time,interested meeting nice guy looking normal relationship someone interested going date movie dinner coffee call go see giant shark warrior play go concert show interested lot drama stress got enough already,white,72,40000,,2012 06 13 07 20,walnut creek california,doesn rsquo kid,straight,dog,catholicism serious,,sagittarius doesn rsquo matter,,english fluently,single
541,57,thin,mostly anything,rarely,never,dropped college university,june update camping colorado rockies visiting relative midwest next couple month will checking mail occasionally thanks reading live van set rv choice enjoy comfortable stress free life style mortgage rent solution noisy neighbor turn key away beyond simplicity think appreciated living way every day little adventure live life purposefully spontaneously challenged random event thinking foot good boy friend confident romantic creative affectionate man good sense humor good conversation dependable life usually simple one simple pleasure happy never mood swing depressed rarely fearful open minded accepting people choice searching woman calm self assured happy life pleasantly going good sense humor still interested intimacy life don plan change significantly seeking co habitation beautiful woman come shape size color don make distinction really mutual chemistry feel good connection potential continue search healthy completely std free active enjoy door travel new experience shared hope ll take moment ask learn thanks friend recommended concealing making mention living van put woman ve declined feel deceptive though don mean emphasize know eventually someone will see past obstacle giving chance will discover good guy great,enjoying life day day basis staying moment occasional travel wandering quartzsite az january hiking mojave february back bay area nice catch daughter now colorado rockies midwest visiting relative,finding thing coming new idea,guess hair turning pure white,really thai indian mexican cuisine rock head banging stuff wire pretty good lite reading read lot enjoy thriller,child hope dream new experience,thinking fluid don dwell anything particular,time friend alone dog,public admission confession,re pleasant woman man already happy life,white,70,,,2012 06 30 20 29,berkeley california,kid doesn rsquo want,straight,dog,atheism,,pisces doesn rsquo matter,,english,single
555,33,athletic,anything,rarely,never,graduated college university,point life got duck row understand type person working every day mellow person love make others laugh strive assume best people treat others treated caring callous grateful resentful remain stoic dealing misfortune,manage team dozen developer software company half team local india 12 hour difference enjoy sizable team work around clock even though requires juggling feel blessed staff execute idea focus creating designing project,really good making turkish coffee moka pot coffee home fresh ground espresso crema office decent cook thanks pb fascination exploring asian indian middleeastern grocery aisle knowing way around trader joe avid diy guy see something hiring professional still car maintenance ve ran internet cable wall crawlspace fixed leaky faucet installed new fence post downed fence say generally handy follow direction athletic enjoy playing basketball snowboarding yoga swimming,people met usually surprised tell long ve working guess look younger age perhaps natural reflection personality stay young heart,favorite food bistro modern french influence lebanese middle eastern shanghainese cantonese japanese thai yummy yogurt current favorite keep npr american life fresh air radiolab boingboing net grantland scientific american mind america test kitchen chopped mashups tv crowd arrested development weed breaking bad mad men dexter 30 rock community abdc colbert report old favorite don usually re watch movie listen band movie shawshank redemption memento pulp fiction city god dirty pretty thing dark knight inglourious basterds air life others rushmore election music death cab cutie marvin gaye green day notorious big smashing pumpkin blur nine inch nail bat lash amanda blank avril lavigne weezer cure echo bunnymen pixy lily allen ceelo royksopp tupac,health humor family friend mind soul,naturally analytical trained engineer spend lot time thinking improving thing fixing problem ve optimism thing always made better permeates aspect life trying improve mind body improving baking recipe,sneaking work early going gym release stress basketball court usually go dvd see parent house ll watch movie projector eating chinese takeout dim light,yes enjoy pop dance music decade went phase listen npr sometimes news depressing thanks internet started listening mash ups mix old new music different genre never image fun music stimulating brain well internet easy look actual piece make mash ups rabbit hole went came liking bunch old stuff queen fleetwood mac frankie go hollywood chic bunch new stuff martin solveig robin silversun pickup learned prejudice britney bieber now whenever npr boring ll switch radio pop music drive course nothing beat shuffling foot private thing willing admit,message re compassionate considerate don re mean selfish,asian,67,,computer hardware software,2012 06 23 10 59,redwood city california,doesn rsquo kid,straight,like dog like cat,agnosticism serious,,scorpio doesn rsquo matter,,english fluently,single
579,29,fit,mostly vegetarian,socially,never,dropped college university,musician amp ve long dreamt making name west coast moved bay area october looking anything serious right now friend mostly looking someone hang amp make music literally possibly figuratively jam go local dive stay amp cook really cooking really food sooo,much ve writing score short film show animation etc new guitarist cold grave nasty oakland based death metal gt moved bay make new music new friend far good,making music making food impression showing saying word ham deep loud amp robust baritone impressing stuff amp thing,indian princess hair eye oh yeah tattoo face,favorite book include beyond good amp evil watership exquisite corpse first book read kid anne rice vampire chronicle reading fun amp really read nothing better almost never case favorite music includes pink floyd modest petrovich mussorgsky opeth led zeppelin rammstein depeche mode katatonia pyotr ilyich tchaikovsky mastodon porcupine tree sister mercy type negative portishead really anything great big wall sound melodic passionate amp well produced don dance unless ve drinking good deal pretty girl dance pretty much always gotta rockabilly actually want dance feel as don watch much tv dexter doctor true blood recently game throne eat mostly vegetarian strict way love italian food obsessed avocado make best vegan chilli existed try,air water food shelter music sex probably order re literal say something avocado italian food home recording studio contraceptive,haaaam music amp will never enough hour day make much want thing go aspect life wish time,everything typical,nice try,musician amp make music together find creepy thing hilarious amp find wholesome thing creepy blasphemy black metal amp body art make way happy zero desire go burning man really feel,native american white,66,20000,artistic musical writer,2012 06 29 22 03,oakland california,doesn rsquo kid doesn rsquo want,straight,like dog,atheism laughing,,libra rsquo fun think,,english fluently spanish poorly german poorly,single
592,56,average,mostly vegetarian,,never,graduated ph program,rewriting profile quite long time feel wonderful fresh written mar 25 2012 curious long will still think high integrity committed truth telling care infinitely curious thing full energy vitality funny odd mix gentle fierce one sister fighting life cancer work world two gripping compelling thing life either want nourishes friendship high,teach nonviolent communication nvc write co founded non profit organization teaching nvc sister 2002 die consciously want know done nurture world long one work blog write regularly usually week exciting fascinating called fearless heart want look active learning reach state flow without holding back much,communication hope teach laughing making others laugh thinking stuff listening people cooking seeing heart matter,smile strong presence honesty,notice glaze list item category really hard true sense person item come match search decided add word really want book movie touch heart inspire serve antidote harshness life cynicism around music different beauty joy now specific novel one hundred year solitude see love homo faber non fiction numerous list haven reading much going movie movie real make people look real loving music primarily european classical especially earlier 1850 latin jazz world music food many cuisine spicy food food lot liquid eat primarily organic vegetarian,sister relationship share biggest treasure life computer primary access connection work friend live far away music direct access joy friend love people love deeply telephone connecting people far away many intimate friendship distant sad true know resilient creature sure find way exist without pain don thing,world collectively grip intensity challenge facing create social personal transformation people really trying understand inside change often,distinction workweek weekend significant life work home except teach even time phone teaching friday special day except shabbat sometimes celebrate sister family wife 12 year old son one favorite people likely evening either friend mostly talking sometimes something seeing movie going performance mostly home reading responding email writing something,really don type question find webdating mostly challenging medium doesn bring care consideration people find painful,thrive depth authenticity focused living dialogue others really going one idea fun naturally gentle care world ideally think make thing work love laughing seriousness really gotten far interested really read carefully mean may enough commonality connect looking serious partnership someone hold life together,middle eastern,63,60000,,2012 06 26 21 54,oakland california,doesn rsquo want kid,gay,like dog dislike cat,,,aquarius rsquo fun think,,english fluently hebrew fluently spanish fluently french poorly,single
598,40,average,anything,socially,never,graduated college university,born raised bay moved back sf last year seven year san diego sd great place san franciscan heart need close family uncle two now true friend hard find socal glad home ready meet new people dating site,manage pr tech company enjoy career work doesn define truly enjoying ll find grabbing dinner drink friend see band play local club running exercising enjoying city marin tahoe great area love travel need travel partner work trip europe last month got ready plan real european vacation travel partner please apply asap time meet partner crime best friend around girl full awesomness word attitude guess important enjoy someone company fun will go supposed go,evidentially really boring crap people re read profile snooze made far don know tell ya anyway good fun whenever appreciate responsible adult really stomach day week gotta fun enjoy life looking married kid buddy old line dating kind weird bag trick good fun come truly bizarre stuff end enjoyable experience chance meet decide re match admittedly elusive year well hey neat cliche believe happens reason,smile friendliness,inception shawshank redemption gladiator usual suspect shawn dead casablanca curb enthusiasm breaking bad son anarchy true blood east bound walking dead game throne autolux twilight singer wilco muse creeper lagoon pete yorn foo fighter black key arcade fire jealous sound stop listening new one,ocean traveling good wine great food local restaurant cooking someone tempur pedic pillow live music family friend,choice brought regret important remember past lesson learned way never want guy say wish done hope partner,meeting happy hour dinner friend movie home wine,simply watch damn spca commercial sarah mclachlan song one willie nelson song,read still think guy want grab beer laugh people anytime oh new amendment send note profile contain picture yoga pose front famous monument picturesque scenery live action shot jumping enjoying burning man sporting southwest cowboy hat kidding kinda,white,68,100000,sale marketing biz dev,2012 07 01 08 24,san francisco california,doesn rsquo kid want,straight,like dog,catholicism serious,,leo,,english fluently italian poorly,single
643,24,average,strictly anything,socially,never,graduated high school,describe one word quirky yup think sum,take picture,doin dorky dance,smile suppose,read watch much movie music dance one watching food omg heart food,son form communication random adventure roll film yes still use film pj pant ice cream something sweet,burrito,depends feel,don drive,want don really care decide contact least little creative kthx,,66,,artistic musical writer,2012 06 28 12 18,alameda california,kid,straight,like dog like cat,agnosticism serious,,taurus rsquo fun think,,english fluently,available
702,24,jacked,mostly anything,socially,never,working college university,laid back guy looking partner crime san francisco native total smarta consider pretty nice easy along reading watching movie going run cooking traveling new place old one food good,currently school sf state getting ba anthropology political science trying figure whole suspended animation thing will work goldfish really happy right now thing better doesn everyone feel way overall satisfied,everything nothing willing try see happens end okay well awesome,tell,book confederacy dunce persuasion tin drum angel america bless ultima one hundred year solitude stardust night fall geek love movie bringing baby pather panchali 400 blow dans paris england broken english slum beverly hill young lifetime africa edward scissorhands mermaid swimming pool layer cake tv buffy vampire diary modern family bored death trueblood oc nanny love lucy 30 rock masterpiece classic game throne barefoot contessa music clash smith kid cudi mo def adele david bowie iron maiden juda priest amy winehouse fleetwood mac robyn queen scissor sister crooked vulture foo fighter ramones blondie kylie black sabbath food mexican italian sheperds pie greek vegan never plan one open anything minus dog cat,air venti americano computer hot cheetos know gin bar soap keeping real,world quite scary place toddler tiara re small look miniature hooker incredible enrique iglesias mole mean one day next ma,either dinner drink drinking writing paper reading veging front tv dancing underwear sleeping,actually 150 year old,re nice guy looking fun tech nerd teach work dvr make computer faster,hispanic latin,70,,student,2012 06 27 08 52,san francisco california,doesn rsquo want kid,gay,dog like cat,agnosticism serious,,scorpio,,english fluently spanish fluently,single
737,25,fit,vegetarian,socially,never,graduated master program,midwestern born southern educated colorado conditioned california explorer,taught 9th grade student denver co past two year now work tech know come next,finding parking spot friday night exploring bay area making chocolate chip cooky,laugh loud,love bluegrass anything barbara kingsolver good whiskey drink terrible movie step,coffee bike ski recreational gear country music clymb similarly addictive deal site chocolate chip cooky gooey one tempur pedic pillow,win hunger game next bike ride dog bella,normally friend grabbing beer,faked eye exam 4th grade glass,re mountain man trapped sf,white,70,,sale marketing biz dev,2012 07 01 07 15,san francisco california,doesn rsquo kid,straight,like dog dislike cat,christianity serious,,pisces doesn rsquo matter,,english,single
738,52,fit,mostly anything,often,never,graduated master program,hmmm mom teacher outdoorsy adventurous pretty happy pretty open minded person single mom kid really young balanced work family life think pretty well actually really well love work good friend sometimes feel life full need add variety basically pretty content outside weekend particularly committed fanatic fit healthy love ski hike walk run bike recreationally pretty willing try anything physical weakness margarita chocolate manage eat fairly healthily really committed family meet someone value well kind home body isn say don night home much one movie concert movie want someone pretty sure trying figure try honest hope find someone value thinker talker well someone like talk time love travel don lot right now hope add life next year,teacher young child lab school affiliated stanford love job variety supervise teacher stanford student even teach class hum bio department present professional adult community love kid good job always learning new thing two teenage kid great love parent enjoying phase despite challenge come spent big chunk life committed parent important time really trying make time getting fun thing socialize try new adventure beach nice find someone liked fun thing music outdoors dinner theater movie game,mom supporting friend fun drinking margarita balancing lot stuff flexible opinionated time,capacity fun,love kind food eating love hear music don tend follow band know something love people know play music don read fair amount mostly fiction work related usually don remember title tell detail reading time love go movie scary bloody one,family friend exercise nature outdoors pet intellectual stimulation fun,want add life much might want change kid add world,either friend excited bed good book going movie,really good listener,interest conversation learn tell,white,68,,education academia,2012 04 23 20 26,menlo park california,kid doesn rsquo want,straight,dog cat,christianity serious,,sagittarius rsquo fun think,,english fluently spanish okay,single
